,soup_words
4817,biography friendship sport miketollin drama
4818,prostitute adoption adoptivefather woodyallen comedy romance
4819,worldwarii sachsenhausen counterfeit stefanruzowitzky drama war
4820,basketball racialsegregation teachersandstudents jamesgartner drama
4821,femalenudity wound suffering luckymckee drama horror
4822,blackpeople wifehusbandrelationship botanist toddhaynes drama romance
4823,womandirector naomifonergyllenhaal drama
4824,fighterpilot cylon bodydouble edwardjamesolmos sciencefiction action adventure
4825,indianterritory apache parody michaelherbig comedy western
4826,rape mutation government wescraven horror
4827,womandirector maryagnesdonoghue comedy drama
4828,paris fathersonrelationship amazon hervépalud adventure drama comedy
4829,wife musical marriage richardlagravenese comedy drama music
4830,londonengland cia teenagehero kevinallen comedy
4831,malenudity newlove lover(female) francozeffirelli drama romance
4832,stewardess casting boss brunobarreto comedy romance
4833,submarine california worldwarii stevenspielberg action comedy
4834,technology kidnapping future noelclarke thriller action sciencefiction
4835,prison repayment gangwar stevecarr comedy
4836,militaryschool larryshaw comedy
4837,1970s river texas davidlowery crime drama romance
4838,newyork sex basedonnovel phillipnoyce drama thriller
4839, jasonkrawczyk thriller horror comedy
4840,industrialist wheelchair bodyguard petermedak horror thriller
4841,newlove loveofone'slife unexpectedhappiness joanchen drama romance
4842,newyork alcohol sex haroldbecker drama crime mystery
4843,basedonnovel photographer baseball walterhill comedy
4844,jealousy inventor neighbor barrylevinson comedy
4845,winter cliff cooking antoniabird comedy horror thriller
4846,kidnapping detroit danielschechter comedy crime
4847,rape trauma highschool jessicasharzer drama
4848,longisland crush wealth jackclayton drama romance
4849,prostitute laundromat marvelcomic philjoanou action crime thriller
4850,vietnamwar hauntedhouse author steveminer comedy horror
4851,gay comingout highschool darrenstein comedy
4852,assertion investigation internalaffairs joecarnahan action crime drama
4853,son attic mothersonrelationship d.j.caruso drama thriller horror
4854, nicolasvanier adventure
4855,italy lie woodcutter robertobenigni comedy family fantasy
4856,usa whitehouse usapresident oliverstone drama history
4857,grandmothergranddaughterrelationship roadtrip abortion paulweitz comedy drama
4858,wormhole spacetravel supernaturalpowers robertc.cooper adventure sciencefiction
4859,brotherbrotherrelationship mentor restart timblakenelson comedy crime drama
4860,fathersonrelationship indiana son davidanspaugh drama family
4861,witch independentfilm curse courtneysolomon horror thriller
4862,duringcreditsstinger bobbyfarrelly comedy
4863,christianity mexico thief alejandrojodorowsky drama
4864,chess spy german billywilder comedy drama war
4865,lossoflover mountainlake author chrisnoonan drama family romance
4866,moon casino bar ronunderwood action comedy sciencefiction
4867,basedonnovel gun settler georgestevens drama western
4868,romance comedy alexandrecastagnetti comedy romance
4869,worldwarii lie cellar emirkusturica war drama comedy
4870,exoticisland willtosurvive gangwar harryhook adventure drama thriller
4871,chainsaw infection quarantine zachlipovsky horror sciencefiction
4872,mountain mountainvillage friendship michaelhaigney adventure fantasy animation
4873,deadanimal shottodeath teenageboy victorsalva drama fantasy sciencefiction
4874,experiment psychology government chrissparling horror
4875,santaclaus lapland horror jalmarihelander fantasy
4876,agedifference girlfriend man-womanrelation federicomoccia comedy
4877,sistersisterrelationship makeamatch single garydavidgoldberg romance comedy
4878,hammer gore slasher tobehooper horror
4879,socialsatire macciocapatonda comedy
4880,brotherbrotherrelationship inventor museum deancundey adventure comedy family
4881,competition prison california stanleykramer action adventure comedy
4882,londonengland diamondmine juwelryheist michaelradford crime drama thriller
4883,france femalenudity sex laurentbouhnik drama romance
4884,gay brotherbrotherrelationship fathersonrelationship jean-marcvallée drama
4885,newyork vatican dutch bradpeyton horror thriller
4886,paris france newidentity briandepalma thriller crime romance
4887,overweightchild sport teacher craiggillespie comedy romance
4888,pregnancy familyvacation widower douglasmcgrath romance comedy
4889,sicily mayor salvatoreficarra comedy
4890,chicago prostitute rape johnmcnaughton crime drama horror
4891,countryside journalist village stephenfrears comedy romance
4892,mutant faith soldier simonhunter action adventure horror
4893,scotland whiskey communityservice kenloach drama comedy
4894,detective vampire supernatural kevinmunroe action comedy horror
4895,stockholmsyndrome kidnapping revenge hanspettermoland thriller action comedy
4896, sergiocastellitto drama romance war
4897,newyork marriageproposal fbi kellymakin comedy crime romance
4898,magic pirategang galier pinovanlamsweerde family animation adventure
4899,pilot flyingsaucer base christiannyby horror sciencefiction
4900,rape gun birthday wescraven horror thriller
4901,zombie eastendoflondon pensioners matthiashoene comedy horror
4902, yanngozlan drama thriller
4903,flying pilot kampfjet clinteastwood sciencefiction action adventure
4904,prostitute rape stripper jakescott drama
4905,newyork highschool teacher kevinreynolds drama thriller
4906,vietnamveteran losangeles crime craigmoss action drama
4907,cataclysm airplane single bronwenhughes romance comedy
4908,streetgang billard colour-blindness francisfordcoppola action adventure crime
4909,musician concert retired dustinhoffman drama comedy romance
4910,suicide sex sweden lukasmoodysson crime drama
4911,spacecolony spacetravel simulatedreality ivanengler thriller mystery sciencefiction
4912,school teenager peterhutchings comedy
4913,car short pixaranimation petedocter animation family
4914,angel rape subway geemaliklinton drama crime thriller
4915,sport walterhill action adventure drama
4916,coma training cop brucemalmuth action thriller
4917,gay newyork freelove johncameronmitchell romance drama comedy
4918,paris raceagainsttime hospital fredcavayé action thriller crime
4919,paris brotherbrotherrelationship chauffeur sydneypollack comedy romance
4920,sex-shop poetry youngadult scottcoffey comedy
4921,smoking cat menace lewisteague comedy thriller horror
4922,prison fathersonrelationship homicide spikelee drama
4923,technology civilization humanvsnature godfreyreggio documentary music
4924,parkour arielzeitoun action crime drama
4925,biography wrestling sport niteshtiwari drama
4926,emperor chineseemperor warrior nickpowell action
4927,one-nightstand ericengland horror thriller
4928,date prison nurse fouadmikati drama thriller
4929,sistersisterrelationship secret romance lynnshelton drama comedy
4930,u.s.navy biography denzelwashington drama romance
4931,prison prisoner deathrow marcrocco crime drama
4932,talkshow darkcomedy womandirector shirapiven comedy drama
4933,corruption chicago cia andrewdavis action adventure drama
4934,monster ireland drunk jonwright sciencefiction comedy thriller
4935,ransom hostage kidnapping luismandoki action crime drama
4936,poison telegram honeymoon alfredhitchcock mystery thriller
4937,slavery dystopia space renélaloux animation fantasy sciencefiction
4938,waitress marriageproposal flirt brianlevant sciencefiction comedy family
4939,upperclass date terrorist luisbuñuel comedy
4940,superhero kidsandfamily peterhewitt family fantasy comedy
4941,experiment supernatural paranormal toddlincoln horror thriller
4942,rape castration revenge meirzarchi horror thriller
4943,disgust pain stunts jefftremaine comedy documentary
4944,newyork atomicbomb ladykiller russellmulcahy adventure fantasy action
4945,destroy dystopia reincarnation racheltalalay action comedy fantasy
4946,talent success musician ginaprince-bythewood romance drama
4947,rape river childmurderer caryfukunaga drama action thriller
4948,basedonnovel gold treasure randalkleiser action adventure drama
4949,femalenudity sex stalker barbetschroeder thriller
4950,halloween friends littlebrother joshschwartz comedy
4951,painter rape russia andreitarkovsky drama history
4952,lossoflover love blood giljunger fantasy drama romance
4953,musical duringcreditsstinger kevintancharoen music comedy drama
4954,paris côted'azur heist joelhopkins comedy
4955,angel archangelgabriel menschheit gregorywiden fantasy horror thriller
4956,blackmail humor stupidity ianmacnaughton comedy
4957,poison journalist lethalinjection tiwest horror mystery thriller
4958,singleparent waitress fountain joenussbaum comedy
4959,wound mountaineer peru kevinmacdonald documentary action adventure
4960,gore extremeviolence extremeblood johnhyams thriller action sciencefiction
4961,diary marriage wine rémibezançon drama
4962,courtcase staatsanwältin familyclan sidneylumet drama
4963,molotowcocktail healthfood speechimpediment tommankiewicz action comedy crime
4964, kheiron drama comedy
4965,hairdresser shop neighbor timstory comedy drama
4966,roleofwomen ladykiller success reginaldhudlin comedy romance
4967, kylebalda animation comedy family
4968,starships spacemarine cgi shinjiaramaki animation action sciencefiction
4969,holiday santaclaus departmentstore georgeseaton drama family
4970,competition opression marriage zhangyimou drama
4971,extraterrestrialtechnology dystopia alienlife-form nicolasroeg drama sciencefiction
4972,femalenudity sex drowning ivankavanagh horror mystery thriller
4973,brothersisterrelationship sweden lossofchild ingmarbergman fantasy drama mystery
4974,cafe swedish pezdispenser stéphanefoenkinos drama comedy romance
4975,newyork sex nightclub markchristopher music drama
4976,hero menace bravery donchaffey adventure family fantasy
4977,mystery psychologist divorce davidcronenberg horror sciencefiction thriller
4978,desert hunting jean-baptisteléonetti thriller
4979,kingdom war medievalindia s.s.rajamouli action adventure history
4980,secretidentity gold gangsterboss simonwincer adventure action
4981,gold blackmail bankrobber davidmamet action crime drama
4982,murder truecrime rodblackhurst documentary
4983,fathersonrelationship parentchildrelationship workaholic brianrobbins comedy family
4984,supercomputer computerprogram destiny microdgers action sciencefiction
4985,mercenary training greek russellmulcahy fantasy action adventure
4986,femalenudity pornography claustrophobia briandepalma crime mystery horror
4987,assassin smalltown forest sngmoolee adventure fantasy action
4988,malenudity cage kiss michaeljaiwhite drama action
4989,president history conspiracy robertredford crime drama history
4990,robbery diamant côted'azur blakeedwards mystery comedy crime
4991,suspense steveshill drama thriller
4992,timetravel highschoolreunion francisfordcoppola comedy drama fantasy
4993,drugdealer marijuana weed+ jérômeenrico crime comedy
4994,lovetriangle italy filmbusiness jean-lucgodard drama
4995, gabrielesalvatores drama crime
4996,dccomics superhero basedoncomic laurenmontgomery action animation sciencefiction
4997,florida nasa tornado anthonyc.ferrante tvmovie horror sciencefiction
4998,wolf animal epicbattle jean-jacquesannaud adventure drama
4999,mexicocity midlifecrisis cocktail richardshepard action comedy crime
5000,vororte blackhumor satire andrewcurrie romance comedy drama
5001,poker gambling casino ryanfleck drama
5002,lifeanddeath supernatural rescuemission makotoshinkai animation adventure drama
5003,africa southafrica britisharmy cyendfield action drama history
5004,california stewardess fog edwardd.woodjr. sciencefiction horror
5005,mistakeinperson falseidentity armsdealer lesmayfield action comedy crime
5006,iraq smallvillage occupation fernandocoimbra drama war
5007,professor vampire romanpolanski comedy horror
5008,beach island rockstar randalkleiser family romance
5009,exoticisland treasure map rennyharlin action adventure
5010,exorcism examination pactwiththedevil johnboorman horror thriller fantasy
5011,suspicionofmurder gigolo callboy paulschrader thriller drama crime
5012,housewife protection motherlylove johnwaters comedy crime horror
5013,nurse menace isleofwhite jaumebalagueró horror thriller
5014, lucianosalce comedy
5015,drugdealer bestfriend wedding stephanelliott comedy
5016,france resistance parentchildrelationship louismalle drama war
5017,cook cooking restaurant petergreenaway crime drama
5018,nun hair zombie andrewgoth action horror
5019, jamesgriffiths comedy
5020,hawaii harassment pearlharbor fredzinnemann war drama romance
5021,ocean himalaya ice alastairfothergill documentary
5022,monster subway cellar christophersmith horror thriller mystery
5023,sheriff basedonnovel smalltown fraserclarkeheston drama horror
5024,swimmingpool teakettle congaline nicktomnay comedy thriller crime
5025,cupboard games puppet frankoz adventure family fantasy
5026,sanfrancisco liberationofhostage police thomascarter action adventure comedy
5027,spacemarine vampire flyingsaucer tobehooper fantasy horror sciencefiction
5028,rome romanempire magic raygoossens family animation adventure
5029,firemen pilot airplane stevenspielberg fantasy drama romance
5030,dinosaur 3d neilnightingale animation family adventure
5031,magic galier basedoncomic gerhardhahn family animation adventure
5032,suicide lossofson helicopter robertaltman comedy drama
5033,japan suicide asia masakikobayashi action drama history
5034,dwarves household lawyer peterhewitt adventure fantasy action
5035,helicopter treasure pyramid enriquegato animation comedy adventure
5036,butler dublin maid rodrigogarcía drama
5037,china chinesewoman secretagent christianduguay crime action adventure
5038,android alien garyfleder action sciencefiction thriller
5039,fantasy motel highway bobgale adventure comedy drama
5040,training sport gym georgebutler documentary
5041,suicide california sex edwardlachman drama
5042,secret test school brianrobbins comedy crime
5043,tradition dream musical normanjewison drama romance
5044,witch deception prank caradogw.james horror
5045, joedante comedy horror
5046,letter jumping childprodigy scotthicks drama
5047,gorilla menace poacher michaelapted drama
5048,action robmeltzer comedy
5049,rome coffin sacrifice darioargento horror
5050,witch wolf littleredridinghood mikedisa comedy animation family
5051,londonengland prostitute hotel stephenfrears crime drama thriller
5052,semiautobiographical womandirector bipolar mayaforbes comedy drama
5053,japan samurai emperor akirakurosawa action drama history
5054,hotel infidelity one-nightstand miguelarteta comedy
5055,jumping lamb short budluckey animation family
5056,ocean carrace braintumor thomasjahn comedy crime
5057,paris france freedomfighter jacquesaudiard crime drama
5058,confession one-nightstand policecorruption orenmoverman crime drama
5059,sistersisterrelationship dance barbie gregrichardson animation family
5060,centralandsouthamerica farmworker farm billeaugust romance drama
5061,femalenudity sex rome juliomédem drama romance
5062,mumblecore jayduplass comedy drama romance
5063,vietnamwar u.s.soldier antiwar dannymooney drama romance war
5064,snowman snowglobes short johnlasseter animation
5065,competition adversary sport samweisman action comedy drama
5066,sex seduction comicbook ralphbakshi animation comedy fantasy
5067,deathpenalty suspicionofmurder exorcism williampeterblatty thriller horror mystery
5068, rodlurie drama thriller
5069,mythology neworleans vampire jonathanfrakes fantasy action adventure
5070, kareykirkpatrick comedy
5071,toy transformation basedontoy nelsonshin animation
5072,witch massachusetts passion nicholashytner drama history
5073,drugdealer undercoveragent gangleader mariovanpeebles thriller crime drama
5074,escape torture model rolandjoffé crime horror thriller
5075,megaphone feminism future peteravanzino animation comedy
5076,archaeologist koreanwar northkorea kangje-gyu action adventure drama
5077,helicopter nasa texas peterhyams drama action thriller
5078,sharkattack louisiana dirtycop davidr.ellis horror thriller
5079,sweden smalltown forbiddenlove lukasmoodysson comedy romance drama
5080,"anime dragonball, shigeyasuyamauchi animation adventure family"
5081,motel crimeboss davidgrovic crime drama thriller
5082,buriedalive georgesluizer thriller drama mystery
5083,rookiecop clinteastwood action crime drama
5084,paris painting independentfilm jean-lucgodard drama thriller
5085,holiday paris parentchildrelationship claudepinoteau comedy
5086,surfer province deathofafriend jakekasdan comedy drama
5087,technology computer history alexgibney documentary
5088,amateurdetective pickpocket slapstick busterkeaton fantasy drama comedy
5089,loveofone'slife ladykiller one-nightstand tilschweiger drama comedy romance
5090,americanfootball sport highschoolsports thomascarter drama
5091,assassin deathpenalty doomedman johnbadham crime drama thriller
5092,friendship secretadmirer postcollege joelschumacher drama romance
5093, jameshuth comedy romance
5094,fountainofyouth basedonnovel secret jayrussell drama family fantasy
5095,cook friendship bruceberesford drama
5096,lake anthology revenge michaelgornick horror
5097, riccardomilani comedy
5098,england fire conductor paulhyett horror
5099,senate general market ralphfiennes drama thriller
5100,independentfilm harmonykorine drama
5101,corruption moderator tvshow dannydevito comedy crime drama
5102,waitress cultureclash romanticcomedy andytennant drama comedy romance
5103,torture seriesofmurders multiplemurders amicanaanmann drama thriller crime
5104,japan funeral forest gusvansant drama
5105,detective virgin delinquent pitof fantasy action thriller
5106,insurancefraud theft artthief williamwyler comedy crime romance
5107,civilwar sicily pastor luchinovisconti drama
5108,underdog monster beauty jeancocteau drama fantasy romance
5109,dccomics basedoncomic superpowers laurenmontgomery action adventure animation
5110,newlove graduation highschoolgraduation peterbogdanovich drama
5111, françoisdesagnat comedy
5112,winter murder slasher bobclark horror mystery thriller
5113, faustobrizzi comedy
5114,paris worldwarii musical vincenteminnelli drama comedy music
5115,suicide prison cocaine avaduvernay documentary
5116,rampage massacre killingspree uweboll action drama crime
5117,tennis tennisplayer sport jakeszymanski tvmovie comedy
5118,independentfilm speedfreak junkycop jonasåkerlund comedy crime drama
5119,brazilian brazil riodejaneiro waltersalles drama
5120,secretidentity hologram basedoncartoon jonm.chu drama music adventure
5121,londonengland ambassador devil'sson grahambaker drama horror thriller
5122,americanfootball billard baseballbat scotthicks drama mystery
5123, nuribilgeceylan drama
5124,midlifecrisis marriage money nicoleholofcener comedy drama romance
5125,killerrobot spacemarine ghostship garynelson adventure family sciencefiction
5126,boston court malpractice sidneylumet drama
5127,sex basedonnovel roommate léapool drama romance
5128,alien spoof sneeze richardbenjamin comedy sciencefiction
5129,soul ireland musicband alanparker comedy drama music
5130,opression campaign chile pablolarraín drama history
5131,boat boataccident underwater andrewtraucki drama horror thriller
5132,gendarmerie jeangirault comedy
5133,journalist kidnapping afghanistan stéphanerybojad action drama war
5134,michigan flat immigration tommccarthy crime drama music
5135,waitress unwillinglypregnant womandirector adrienneshelly comedy
5136,fathersonrelationship hideakianno animation sciencefiction action
5137,nightmare water motherdaughterrelationship hideonakata horror thriller
5138,sex madrid waitress juliomédem drama romance
5139, patrickbrice mystery comedy
5140,chicago infidelity man-womanrelation mikebarker crime drama thriller
5141, michaelpetroni horror mystery
5142,newlove inferioritycomplex fencing jean-paulrappeneau drama comedy history
5143, lucienjean-baptiste comedy
5144,memoryloss jeffbleckner tvmovie romance drama
5145,sex fight television tomvaughan drama comedy romance
5146,fight tournament kick benramsey drama action thriller
5147,coworkerrelationship lying womandirector larashapiro comedy
5148,brain justmarried marriagecontract carlreiner comedy romance sciencefiction
5149,suicide jealousy canada richardj.lewis comedy drama
5150,freelove sex sexuality billcondon drama
5151,artist artists'life childhoodmemory alfonsocuarón comedy drama romance
5152,destroy future worldsupremacy guillaumeivernel animation family
5153,cia biohazard mi5 michaelapted action thriller
5154,basedonnovel romanticrivalry candlelightvigil donroos drama
5155,dance highschool stepbrother peterdeluise comedy family
5156,beach taxidriver worldwarii woodyallen comedy drama
5157,bed skeleton sciencefiction enkibilal drama action sciencefiction
5158,scotland butcher sister thomasschlamme comedy crime romance
5159,winter adventure kids larryroemer animation family
5160,paris adultery louvre francisveber comedy
5161,americanfootball sportsteam stadium georgeclooney comedy romance drama
5162,biography hermanyau action drama
5163,newlove departmentstore mannequin michaelgottlieb fantasy comedy romance
5164,highschool murder slasher josephkahn horror comedy sciencefiction
5165,chicago burglar cardealer michaelmann action crime drama
5166,escapefromprison mistakenidentity fishoutofwater sidneypoitier comedy
5167,experiment surgeon suspense georgesfranju drama horror thriller
5168,cia whitehouse secretservice dwighth.little action drama mystery
5169,sistersisterrelationship sister leukemia jerryzaks drama
5170,trainstation loneliness billeaugust mystery romance thriller
5171,angel sex robbery dannyboyle fantasy drama comedy
5172,malenudity femalenudity violence abelferrara thriller crime
5173,chicago basedonnovel monster peterhyams horror mystery thriller
5174,suicideattempt isolation loneliness leehae-jun drama comedy romance
5175,lover(female) talent mafiaboss woodyallen action comedy thriller
5176,oregon blackmail callcenter jean-baptisteandrea action comedy crime
5177,humananimalrelationship whale killerwhale dwighth.little adventure
5178,alcohol rape bar jonathankaplan drama
5179,kingdom lightsaber cultfavorite peteryates fantasy action adventure
5180,horror vision pregnant kevingreutert thriller horror
5181,femalenudity nudity gore luciofulci horror
5182,londonengland optimism homelessperson mikeleigh drama comedy
5183,grandmothergranddaughterrelationship promiscuity motherdaughterrelationship garrymarshall comedy drama romance
5184,newlove countryestate countryhouse oliverparker comedy drama history
5185,womandirector blendedfamily rebeccamiller drama comedy romance
5186,paris italy assassin bernardobertolucci drama
5187,orchestra musical concert radumihaileanu drama comedy
5188,teleportation humanexperimentation hybrid kurtneumann drama horror sciencefiction
5189,usapresident presidentialelection comedian barrylevinson comedy drama romance
5190,gunslinger mexico french donsiegel western
5191,religiousconversion spirituality colonisation ciroguerra adventure drama
5192,journalist martialarts cook sammohung crime action comedy
5193,musicfestival independentfilm catskills anglee music comedy drama
5194,trainaccident attempttoescape prisonwarden andreikonchalovsky action thriller
5195, hideakianno animation sciencefiction action
5196,asylum frenchrevolution french philipkaufman drama
5197,newjersey musical battleofthebands toddgraff comedy drama family
5198, davidjung horror
5199,peasant brother revenge ingmarbergman crime drama
5200,hold-uprobbery cops counterfeit williamfriedkin action crime thriller
5201,usa china assaultrifle antoinefuqua action drama crime
5202,honesty businessman johnlandis action comedy thriller
5203,sheriff journalism newmexico billywilder drama
5204,coldwar superhero sarikandreasyan action fantasy sciencefiction
5205,martialarts weapon jackiechan action crime thriller
5206,basedonnovel hitchcockian sixthsense alexandreaja fantasy thriller mystery
5207,lossofmother lossofsister twinsister michaelapted drama thriller
5208,jamesdean magazine biography antoncorbijn drama
5209,prison smoking infidelity lawrencekasdan drama thriller crime
5210,basedonnovel indianterritory fight arthurpenn adventure western history
5211,marriedcouple friends fallinginlove woodyallen comedy drama romance
5212,picnic ant animation hélènegiraud animation adventure family
5213,stripclub alzheimer sexaddiction clarkgregg comedy drama
5214,magic roman assault philippegrimond family animation adventure
5215,basedonnovel biography police robertlieberman drama horror thriller
5216,femalenudity nudity motel richardfranklin horror mystery thriller
5217,fbi johnf.kennedy hospital peterlandesman history drama thriller
5218,desperation elite fame kevinkolsch horror
5219,londonengland sex dyinganddeath laurencedunmore drama romance
5220,fountain rivalry coin andrewjimenez animation family
5221,filmproducer midlifecrisis independentfilm barrylevinson comedy drama
5222,independentfilm commitment lobster donaldpetrie comedy drama romance
5223,adultery wifehusbandrelationship toronto sarahpolley drama comedy
5224,chicago religionandsupernatural supernaturalpowers garysherman horror thriller
5225, audreydana comedy
5226,loveofanimals horse identitycrisis frederikduchau comedy
5227,panic attack sexualattraction davidcronenberg horror sciencefiction
5228, claudiofäh adventure
5229, philipkaufman action adventure crime
5230,invisibleman johncarpenter comedy fantasy sciencefiction
5231,magic wishfulfillment johnr.leonetti fantasy horror thriller
5232,grifter con bigcon jamesfoley action comedy thriller
5233,londonengland secret sociallydeprivedfamily mikeleigh drama
5234,rape secret minnesota nikicaro drama
5235,soccer juanjosécampanella animation adventure romance
