,soup_words
2341,college rivalry friendshipbetweenmen richardlinklater comedy
2342,childabuse rape fire pedroalmodóvar comedy drama romance
2343,basedonnovel biography historicalfigure simoncurtis drama
2344,coffin pet funeral marylambert drama horror
2345,wheelchair horror killerdoll donmancini horror thriller
2346,basedonnovel prohibition florida benaffleck crime drama
2347,dream nightmare insomnia mikeflanagan drama fantasy horror
2348,japan dream procession satoshikon animation drama mystery
2349,fortuneteller religionandsupernatural supernaturalpowers m.nightshyamalan drama thriller fantasy
2350,cash wrongdiagnosis foretelling guyritchie drama thriller crime
2351,venice france prison shawnlevy comedy
2352,paris flying inventor ericsummer animation family adventure
2353,beach wifehusbandrelationship lake jameswatkins horror thriller
2354,riot war british yanndemange thriller action drama
2355,date flirt dance bobbyfarrelly comedy
2356,lifeanddeath afterlife swing joelschumacher drama horror sciencefiction
2357,nurse musicteacher aging michaelhaneke drama romance
2358,rockstar groupie mockumentary robreiner comedy music
2359,judge architect ghostworld peterjackson horror comedy
2360,badmother-in-law surgeon dogsitter robertluketic romance comedy
2361,massmurder plannedmurder chainsaw jonathanliebesman horror
2362,usa relatives familyvacation haroldramis comedy adventure romance
2363,mayor island policechief jeannotszwarc horror thriller
2364,hotdogcostume electroshock fakeschool stevepink comedy
2365,gay narration homosexuality xavierdolan drama
2366,rebel adolescence brothel dennishopper adventure drama
2367,refugeecamp hurricane fantasy benhzeitlin drama fantasy
2368,dccomics future basedongraphicnovel jayoliva action animation
2369,scotland loveofone'slife ladykiller paulweiland comedy romance
2370,submarine captain kevinmacdonald adventure
2371,videogame gun classroom gusvansant drama crime
2372,londonengland alien teacher terryjones comedy sciencefiction
2373,opera biography singingfalse stephenfrears comedy drama
2374,sexualobsession hotel depression stanleykubrick drama romance
2375,rome resistance romanempire claudezidi family adventure comedy
2376,marriageproposal isolation yellowpress markpalansky fantasy comedy romance
2377,malenudity femalenudity pornography srđanspasojević horror crime thriller
2378,newyork marriageproposal alabama andytennant comedy romance
2379,fool taxinspector francisveber comedy
2380,france gypsy childabuse andytennant drama romance comedy
2381,psychology policeoperation police leetamahori crime mystery thriller
2382,independentfilm aftercreditsstinger duringcreditsstinger kevinsmith comedy
2383,newyear'seve fire showdown jamesmcteigue thriller
2384,hotelmom romanticcomedy lying tomdey comedy
2385,nasa spacetravel astronaut clinteastwood action adventure thriller
2386,england adultery duke sauldibb drama history romance
2387,femalenudity hacker nudity iainsoftley action crime thriller
2388,dancer cinderella dance damonsantostefano music
2389,faculty arthistory rowing mikenewell drama romance
2390,motel hiddencamera remoteness nimródantal horror thriller
2391,1970s afghanistan hanggliding marcforster drama
2392,farm cow animal willfinn animation family
2393,cook warship mercenary andrewdavis action thriller
2394,volcano romance short jamesfordmurphy animation family
2395,femalenudity rape nudity christophegans adventure horror action
2396,rome italian ridingabicycle vittoriodesica drama
2397,angel suicideattempt fistfight charliechaplin comedy drama
2398,deathoflover artthief artgallery mortentyldum thriller crime
2399,fathersonrelationship popsinger musical kevinlima romance animation family
2400,poem middleeast helicopter ridleyscott action drama
2401,christianity philosophy egypt alejandroamenábar adventure drama history
2402,vietnamveteran posttraumaticstressdisorder bar oliverstone drama war
2403,melancholy trainride train makotoshinkai animation drama romance
2404, jobyharold thriller crime mystery
2405,lighthousekeeper derekcianfrance drama
2406,gold fraud wallstreet stephengaghan thriller adventure drama
2407, matteogarrone romance fantasy horror
2408,skabundertv øverstehylde foran michaelmoore 
2409,spaceopera retribution spacecraftofficer jonathanfrakes sciencefiction action adventure
2410,showdown resistance mannequin georgep.cosmatos action crime thriller
2411,hippie commune nudism davidwain comedy
2412,housefire extensionladder lastdayonjob jimsheridan drama thriller mystery
2413,3d alexandreastier animation comedy adventure
2414,prison boxer boxingmatch normanjewison drama
2415,senator gulfwar canoe jonathandemme drama thriller mystery
2416,california assassin infidelity joelcoen crime comedy romance
2417,sex gameshow slacker kevinsmith romance comedy
2418,newyork dictator africa sydneypollack crime thriller
2419,mercenary murder puritan michaelj.bassett adventure fantasy action
2420,heist johnluessenhop action crime drama
2421,slum streetgang loveatfirstsight jeromerobbins crime drama music
2422,malenudity sex menageatrois davidcronenberg drama
2423,comedian cancer bromance juddapatow comedy drama
2424,prison muslim arabian jacquesaudiard crime drama
2425,assassin hitman pierremorel action drama crime
2426,wildwest frankcoraci comedy western
2427,sheriff bounty bountyhunter jimjarmusch drama fantasy western
2428,policebrutality basedontruestory racism ryancoogler drama
2429,farewell adultery loveatfirstsight clinteastwood drama romance
2430,basedonnovel fallenangel teenager scotthicks drama fantasy romance
2431,painter loveofone'slife disabled julietaymor drama romance
2432,prostitute hallucination stripclub gasparnoé fantasy drama
2433,familyfeud martinbourboulon comedy
2434,curse suitor falseaccusations andrewdavis adventure family drama
2435,americanfootball parentchildrelationship boat guillaumecanet comedy drama
2436,martialarts kungfu patriotism ronnyyu drama action
2437,germany witch boardingschool darioargento horror
2438,holiday femalefriendship jeans kenkwapis drama comedy
2439,airplane therapture remake vicarmstrong thriller action sciencefiction
2440,guantanamobay femalesoldier femaleprotagonist petersattler drama
2441,bowling blinddate party benpalmer romance comedy
2442,hitman romanticcomedy pacocabezas action comedy romance
2443,judge suspect interrogation oriolpaulo mystery crime thriller
2444,holiday tvratings comedy richarddonner fantasy comedy drama
2445,italy cheating lie lucaminiero comedy
2446,timetravel sabotage deepspaceexplorer stephenhopkins adventure family sciencefiction
2447,cage dystopia survivor georgea.romero horror
2448,bar monster mentalbreakdown nachovigalondo action comedy drama
2449,gay self-fulfillingprophecy basedonnovel bennettmiller crime drama
2450,ocean coastguard teamwork andrewdavis action adventure drama
2451,competition assassination cia richarddonner action adventure crime
2452,romanempire ancientrome ancientworld neilmarshall adventure action drama
2453,antihero highschool dragonfly craigmazin action comedy sciencefiction
2454, erictoledano drama comedy
2455,prison southernusa suspicion jonathanlynn comedy drama
2456,fight blindnessandimpairedvision asylum fernandomeirelles drama mystery sciencefiction
2457, malcolmd.lee comedy
2458, lucbesson adventure fantasy animation
2459,cia assassin running wolfgangpetersen action drama thriller
2460,green dodgeball incredibile peterhedges fantasy drama comedy
2461,individual dancing usa larsvontrier drama crime music
2462,anthropomorphism teenager psychologicaldrama johncarpenter horror
2463,musical rocker teenager adamshankman comedy drama music
2464,bountyhunter basedonnovel romance julieannerobinson action comedy crime
2465,war racism battle edwardzwick war
2466,alcohol puertorico tvdebate brucerobinson drama comedy
2467,dejavu dyinganddeath timetravel mennanyapo thriller drama mystery
2468,holiday mother'sday garrymarshall comedy
2469,swordplay sword magic richardfleischer adventure fantasy action
2470,corruption sex adultery sidneylumet drama
2471,assassination spy ambush phillipnoyce action drama thriller
2472,prison rebel lossofmother stuartrosenberg crime drama
2473,corruption detective policebrutality peterweir crime drama romance
2474,bird clique awkwardappearance ralpheggleston animation family
2475,halloween west michaeldougherty horror thriller
2476,newyork rome romanticcomedy markstevenjohnson fantasy comedy romance
2477,basedonnovel hauntedhouse supernatural tomharper thriller horror drama
2478, philippelacheau comedy
2479,flower solareclipse florist frankoz horror comedy music
2480,witch suicideattempt puberty andrewfleming drama fantasy horror
2481,berlin longtake bulletwound sebastianschipper drama romance thriller
2482, pascalchaumeil romance comedy
2483,poison newzealand reanimation peterjackson horror comedy
2484,casino sheriff home kevinbray adventure drama action
2485,concert teenager onenight petersollett comedy music romance
2486,alienlife-form dinosaur primate bradsilberling adventure comedy sciencefiction
2487,terrorist parachute president jalmarihelander action adventure thriller
2488,suicide diary friendship michaellehmann thriller comedy drama
2489,father-in-law marriage documentaryfilmmaking noahbaumbach comedy drama mystery
2490,subway lava volcano mickjackson sciencefiction action drama
2491,mining chile basedontruestory patriciariggen drama history
2492,prince watermonster timjohnson family animation adventure
2493,chair customs studentvisa drakedoremus drama romance
2494,washingtond.c. boston chambersofabarrister charlesherman-wurmfeld comedy
2495,illustrator utopia sexscene drakedoremus drama romance sciencefiction
2496,prison gold therapist haroldramis comedy crime
2497,taxi newjersey helicopter robcohen action adventure thriller
2498,camcorder reality insaneasylum colinminihan thriller horror
2499,sadism hostage-taking serialkiller michaelhaneke drama horror thriller
2500,webcam anthology vhs joeswanberg thriller horror
2501,assassination assassin ninjafighter jamesmcteigue action crime thriller
2502,ambush sheriff waitress arthurpenn crime drama
2503,painter biography painting peterwebber drama romance
2504,corruption newjersey handcuffs jamesmangold action crime drama
2505,plagiarizedbook stolennovel plagiarizednovel brianklugman drama thriller
2506,musical monastery billduke music comedy
2507,federation starfleet ussenterprise-a williamshatner sciencefiction action adventure
2508,biography wilsonyip action drama history
2509,riddle detective claustrophobia andrzejsekula thriller sciencefiction mystery
2510,dancingmaster danceperformance lover(female) johnbadham drama music
2511,cia transportofprisoners innocence stuartbaird thriller crime action
2512,regret basedonnovel baseball philaldenrobinson drama fantasy
2513,princess weddingring wedding byronhoward animation comedy action
2514,rugby stranded survival frankmarshall action adventure drama
2515,virtualreality dystopia computer terrygilliam drama fantasy sciencefiction
2516,gambling future timetravel bradleyking thriller sciencefiction
2517,vietnam barrage revitalization rolandemmerich thriller action sciencefiction
2518,revenge murder plottwist jonavnet action crime drama
2519,paranormal psychic skepticism rodrigocortés thriller
2520,secretidentity island monarchy allisonliddi-brown comedy drama family
2521,competition island radio dannycannon horror mystery thriller
2522,newyork captain starships brianrobbins comedy sciencefiction adventure
2523,liar literaryagent brianrobbins drama comedy
2524,baby medicine media ivanreitman comedy family romance
2525,terrorist undercover fbiagent danielragussis crime drama thriller
2526,penguin musical aftercreditsstinger georgemiller animation comedy family
2527,prison usapresident earthquake johncarpenter action adventure sciencefiction
2528,artificialintelligence simulation computerprogram josefrusnak thriller sciencefiction mystery
2529,cat brothersisterrelationship boredom bowelch comedy fantasy family
2530,brain childhoodmemory dystopia robertlongo adventure action drama
2531,womandirector lisaazuelos comedy
2532,brothersisterrelationship marriage bully andyfickman comedy romance
2533,perfectcrime obsession island alfredhitchcock crime drama thriller
2534,adultery lovesickness martialarts wongkar-wai drama romance
2535,rivalry stopmotion pirate peterlord animation adventure family
2536,cancer teenager teendrama olparker drama romance
2537,women baseball pitcher robertlorenz drama romance
2538,suicide clerk fetish stevenshainberg comedy drama romance
2539,chicago journalist newspaper rajagosnell romance comedy drama
2540,prostitute blackmail drugsmuggle johnmichaelmcdonagh action comedy thriller
2541,sistersisterrelationship arrangedmarriage sexism denizgamzeergüven drama
2542,clone lossofsenseofreality hallucination stevensoderbergh drama sciencefiction mystery
2543,england alcohol college lonescherfig drama thriller
2544,france bomb cia jameswatkins action
2545,boardgame mystery mansion jonathanlynn comedy thriller crime
2546,londonengland england daughter denniegordon comedy
2547,anime tadayoshiyamamuro action adventure animation
2548,judge professor missionofmurder alanj.pakula drama mystery thriller
2549,airplane hijacking terrorcell paulgreengrass drama history crime
2550,islam newyork prison spikelee drama history
2551,streetgang blackpeople rapmusic johnsingleton crime drama
2552,sanfrancisco paranoia audiotape francisfordcoppola crime drama mystery
2553,hostage escapefromprison escapedconvict clinteastwood crime drama thriller
2554,violence postalworker figmentofimagination adrianlyne drama mystery horror
2555,undercover nanny computervirus johnwhitesell comedy crime
2556,college internet vengefulghost simonverhoeven horror thriller
2557,upperclass mother singleparent jamesl.brooks comedy
2558,nerd biker teenager johnhughes comedy romance fantasy
2559,highschool basketball revenge bettythomas comedy
2560,ant childhero shrinking johna.davis fantasy adventure animation
2561,basedonnovel garden lossofparents henryselick adventure animation family
2562,mars spacecraft spacetravel briandepalma sciencefiction
2563,dystopia quarantine futuristic neilmarshall action thriller sciencefiction
2564,canada obsession walrus kevinsmith comedy horror
2565,terror california falselyaccused stevenspielberg tvmovie action thriller
2566,basedonnovel trauma castle jandebont horror thriller fantasy
2567,assassin lossoffamily autism haroldbecker action crime drama
2568,duringcreditsstinger tomtykwer drama thriller crime
2569, davids.goyer horror thriller mystery
2570,massmurder popculture socialcommentary bobcatgoldthwait comedy drama
2571,transylvania shapeshifting selfsacrifice f.w.murnau fantasy horror
2572,schizophrenia france rape lucbesson adventure drama action
2573,newyorkcity kitten greatdane georgescribner animation comedy family
2574,manlookingforwife prettywoman takashimiike mystery drama horror
2575,clown boy murder jonwatts horror
2576,suicideattempt striptease steelworker petercattaneo comedy
2577,femalefriendship mermaid teenager elizabethallenrosenbaum fantasy romance family
2578,fire bountyhunter shotgun johnmaclean romance thriller western
2579,virgin summercamp movieinmovie toddstrauss-schulson horror comedy
2580,stage banjo magic dougsweetland animation family
2581,parentchildrelationship penguin brood lucjacquet documentary family
2582,suicide supportgroup depression danielbarnz drama
2583, lucbesson animation adventure fantasy
2584,sheriff mask halloween rickrosenthal horror thriller
2585,bingo basedontvseries dragon masahirohosoda animation action
2586,fight queen penguin jasonfriedberg comedy
2587,smalltown supernatural horror stephensommers mystery thriller
2588,martialarts biography sport newtarnold action
2589,gallows highschool tragedy traviscluff horror thriller
2590,golf underwear sport haroldramis comedy
2591,graduation exhusband womandirector nancymeyers comedy romance
2592,mutant dystopia survivor tedpost adventure sciencefiction mystery
2593,holiday skinhead england shanemeadows drama crime
2594,classroom college teacher tomhanks comedy romance drama
2595,londonengland supermarket nudity seanellis drama comedy romance
2596,basedonnovel comingofage youngboy thorfreudenthal comedy family
2597,police losangeles davidayer action crime drama
2598,brothersisterrelationship sistersisterrelationship familyclan jesseperetz comedy drama
2599,blacksmith brothel femmefatale rza action
2600,journalist biography internet billcondon drama thriller
2601,murder suspense union eliakazan crime drama
2602, nicolasbenamou comedy
2603,nun sport orphanage jaredhess comedy family
2604,newjersey restaurant hitman arielvromen thriller crime drama
2605,jealousy darkcomedy writer jasonreitman comedy drama
2606,blackpeople basedonnovel holocaust richardlagravenese crime drama
2607,gay dancing fire jacksholder horror
2608, pierre-françoismartin-laval comedy
2609,alcohol radio policechief jaychandrasekhar comedy crime mystery
2610,jealousy obsession manipulation josephl.mankiewicz drama
2611,robbery santaclaus armor gérardkrawczyk action comedy
2612, massimovenier comedy
2613,remake alien escape oliverhirschbiegel sciencefiction thriller
2614,skinhead secret murder mathieukassovitz crime mystery thriller
2615,sport rollerderby duringcreditsstinger drewbarrymore drama
2616,california lonewolf leave rianjohnson drama mystery
2617,route66 puppet evildoll ronnyyu horror comedy
2618,hairdresser smalltown conman joelcoen crime drama
2619,loveatfirstsight runaway agedifference woodyallen comedy romance
2620, shinjiaramaki animation sciencefiction
2621,monster darkness desert grégorylevasseur horror
2622,burglar fight psychopath marcusdunstan horror thriller
2623,wifehusbandrelationship channelsurfing mullet alexanderpayne drama comedy
2624,magic fantasy darkness zachhelm comedy
2625,medicine sandstorm army philippstölzl adventure drama history
2626,individual prostitute alcohol mikefiggis drama romance
2627,holiday basedonnovel monster chuckjones animation family comedy
2628,bowling basedonnovel servant anglee drama romance
2629,1970s lossofsenseofreality extraterrestrialtechnology andreitarkovsky drama sciencefiction adventure
2630,italy suicide diving lucbesson adventure drama romance
2631,prison convict toughcop walterhill thriller action comedy
2632,cat humananimalrelationship chase hiroyukimorita adventure fantasy animation
2633,berlinwall paranoia wall alanparker music
2634,grouptherapy nightmare hypnosis chuckrussell horror thriller
2635,fight governance puppy lawrenceguterman comedy family
2636,londonengland robbery burglar christophernolan crime drama thriller
2637,bookshop daughter relationship peterhedges comedy romance drama
2638,bomb prison fathersonrelationship jimsheridan drama
2639,fondling independentfilm nouvellevague françoistruffaut drama
2640,doublelife commercial fantasy peterhowitt comedy drama fantasy
2641,hauntedhouse father-in-law superstition gerardjohnstone horror comedy thriller
2642,baseball worldwarii sport pennymarshall comedy
2643,japan suicide samurai takashimiike adventure drama action
2644,independentfilm parkchan-wook drama thriller
2645, danyboon comedy
2646,buddhism japan suicide bernardobertolucci drama history
2647,malefemalerelationship co-worker relationship joeswanberg romance drama
2648,musical transformation flowergirl georgecukor drama family music
2649,islam muslim carbomb edwardzwick drama action thriller
2650,usa policebrutality coldwar walterhill action crime
2651,timetravel sequel hottub stevepink comedy
2652,religionandsupernatural infection sequel pacoplaza horror
2653,france femalenudity nudity françoisozon drama
2654,brotherbrotherrelationship corruption chicago ronhoward action crime drama
2655,provence winecellar vineyard ridleyscott comedy drama romance
2656,rape sex identity kimberlypeirce crime drama
2657,epilepsy protectionmoney secretlove martinscorsese drama crime
2658,lossofson motel airplane josephruben crime drama horror
2659,stock-car-race daytona carcrash tonyscott adventure
2660,photographer grizzlybear wilderness leetamahori action adventure drama
2661,bachelor ex-boyfriend ex-girlfriend jimjarmusch comedy drama mystery
2662,carrace lossofbrother chimp lillywachowski action family sciencefiction
2663,balletdancer musical ballet thomascarter drama family romance
2664,robbery diamant policeoperation lesmayfield action comedy crime
2665,moon nasa infection gonzalolópez-gallego horror thriller sciencefiction
2666,cheating newidentity computervirus irwinwinkler crime drama mystery
2667,chile gore jungle eliroth action adventure horror
2668,brotherbrotherrelationship office drugaddiction sidneylumet crime drama thriller
2669,biography michaelcuesta thriller crime drama
2670,egypt miracle slavery cecilb.demille drama history
2671,individual blackpeople chauffeur bruceberesford comedy drama
2672,friendship loneliness blackandwhite noahbaumbach comedy drama
2673,comingofage seinen shoemaker makotoshinkai animation drama romance
2674,spy basedonnovel paranoia robertluketic drama thriller
2675,fire nihilism homicide treyedwardshults horror mystery thriller
2676,basedonnovel highschool soccer giacoppola drama
2677,underdog strangeness specialcapabilities d.j.caruso action crime mystery
2678,wish guard stalker andreitarkovsky drama sciencefiction thriller
2679,journalist basedonnovel journalism glennficarra war comedy
2680, pascalchaumeil comedy drama
2681,hawaii honeymoon doublemurder davidtwohy thriller mystery adventure
2682,competition basedonnovel sharkattack seanmcnamara family action drama
2683,cheating dysfunctionalfamily teenangst catherinehardwicke crime drama
2684,newmexico mutant assault martinweisz horror thriller
2685,upperclass basedonnovel skyscraper benwheatley drama
2686,son-in-law father-in-law fool charlesshyer comedy romance
2687, danielstamm horror thriller
2688,disgust pain stunts jefftremaine documentary comedy
2689,california island airplane neillabute mystery thriller horror
2690,vampire spider wolfman paulweitz adventure fantasy action
2691,courtcase gunrampage firearm garyfleder drama thriller
2692,norway monster flyingsaucer howardmccain fantasy action sciencefiction
2693,summercamp camp singing paulhoen comedy music tvmovie
2694,nurse sex confession ingmarbergman drama
2695,washingtond.c. coveredinvestigation investigation garyfleder drama mystery thriller
2696,gay lossofmother secret mikemills drama romance comedy
2697,assassin highschool kylenewman adventure action comedy
2698,holiday nostalgia youngboy bobclark comedy family
2699,hauntedhouse michaeltiddes comedy horror
2700,paris prostitute lossoflover jean-pierrejeunet drama
2701,individual rebel streetgang nicholasray drama
2702,paris cia agedifference stanleydonen comedy mystery romance
2703,self-defense widower danielbarber thriller crime drama
2704,duringcreditsstinger brianlevant action comedy family
2705, felixherngren adventure comedy drama
2706,masseuse thanksgiving party nicoleholofcener comedy drama romance
2707,prison rape sociallydeprivedfamily timrobbins drama
2708,princess japanesewoman basedonfairytale isaotakahata animation drama fantasy
2709,drugabuse secret sadness guillaumecanet drama thriller crime
2710,assassination gun castle akirakurosawa action drama history
2711,martinique claudemonet famouspainting johnmctiernan drama crime romance
2712,newyork brotherbrotherrelationship journalist kevinmunroe adventure animation comedy
2713,handcuffs policechief policeoperation jerryparis comedy crime
2714,italy library cat yoshifumikondô animation drama family
2715,popstar musician recordalbum akivaschaffer comedy music
2716, gennaronunziante comedy
2717,loyalty emperor castle kazuakikiriya action adventure
2718,marriage newlywed firstanniversary danmazer comedy romance
2719,witch magic sorcery griffindunne drama fantasy comedy
2720,sex jealousy virgin seananders comedy adventure romance
2721,sex sexuality irony maggiecarey comedy romance
2722,videogame spy bahamas irvinkershner adventure action thriller
2723,gun saudiarabia love tomtykwer comedy drama
2724,cave water adventure alistergrierson action thriller
2725,monster remake creature troynixey fantasy horror thriller
2726,malenudity femalenudity erection ruggerodeodato adventure horror
2727,duke historicalfigure treason shekharkapur drama history
2728,childabuse prostitute bar davidgordongreen drama
2729,sheep ruralsetting housekeeper thomasvinterberg romance drama
2730,waitress sistersisterrelationship kidnapping heitordhalia drama thriller
2731,baby mask viking lawrenceguterman fantasy comedy family
2732,holygrail homelessperson lossoflover terrygilliam comedy drama
2733,filmbusiness screenplay filmmaking merianc.cooper action adventure drama
2734,angel riddle detective gregoryhoblit thriller fantasy crime
2735,montecarlo basedonnovel agedifference alfredhitchcock drama mystery
2736,malenudity femalenudity hostage yorgoslanthimos drama
2737,suicideattempt timewarp lossofsenseofreality marcforster mystery thriller drama
2738,manvsmachine android saloon michaelcrichton action adventure drama
2739,submarine worldwarii northatlantic jonathanmostow action drama thriller
2740,taxidriver thief fbiagent simonwest action crime drama
2741,poison loveatfirstsight marriageproposal alfredhitchcock thriller drama romance
2742,prison africa southernusa stevenspielberg drama
2743,robbery kidnapping organizedcrime baranboodar action crime thriller
2744,friendship imaginaryfriend photograph hiromasayonebayashi animation drama
2745,japan worldwarii radiotransmission johnwoo drama action history
2746,newyork cat immigration donbluth drama family animation
2747,womandirector severinfiala drama horror thriller
2748,upperclass lossofmother greatbritain stephenfrears drama
2749,paranoia double richardayoade thriller drama
2750,antihero secretagent fistfight marka.z.dippé action adventure fantasy
