,soup_words
0,lossoflover dream kidnapping christophernolan action thriller sciencefiction
1,dccomics crimefighter secretidentity christophernolan drama action crime
2,cultureclash future spacewar jamescameron action adventure fantasy
3,newyork shield marvelcomic josswhedon sciencefiction action adventure
4,antihero mercenary marvelcomic timmiller action adventure comedy
5,savingtheworld artificialintelligence fathersonrelationship christophernolan adventure drama sciencefiction
6,bountyhunter hero plantation quentintarantino drama western
7,marvelcomic spaceship space jamesgunn action sciencefiction adventure
8,supportgroup dualidentity nihilism davidfincher drama
9,hallucination dystopia femaleprotagonist garyross sciencefiction adventure fantasy
10,future chase post-apocalyptic georgemiller action adventure sciencefiction
11,dccomics crimefighter terrorist christophernolan action crime drama
12,savingtheworld artificialintelligence manvsmachine lanawachowski action sciencefiction
13,middleeast armsdealer malibu jonfavreau action sciencefiction adventure
14,terrorist waronterror tennessee shaneblack action adventure sciencefiction
15,elves dwarves orcs peterjackson adventure fantasy action
16,monster dna tyrannosaurusrex colintrevorrow action adventure sciencefiction
17,transporter brothel drugdealer quentintarantino thriller crime
18,riddle elves dwarves peterjackson adventure fantasy action
19,prison corruption policebrutality frankdarabont drama crime
20,elves orcs middle-earth(tolkien) peterjackson adventure fantasy action
21,vietnamveteran hippie mentallydisabled robertzemeckis comedy drama romance
22,android spaceship jedi j.j.abrams action adventure sciencefiction
23,shipwreck iceberg ship jamescameron drama romance thriller
24,spy secretagent sociopath sammendes action adventure thriller
25,dccomics shareduniverse antihero davidayer action adventure crime
26,elves orcs middle-earth(tolkien) peterjackson adventure fantasy action
27,himalaya martialarts dccomics christophernolan action crime drama
28,civilwar war marvelcomic anthonyrusso adventure action sciencefiction
29,basedonnovel mars nasa ridleyscott drama adventure sciencefiction
30,exoticisland blacksmith eastindiatradingcompany goreverbinski adventure fantasy action
31,dccomics vigilante superhero zacksnyder action adventure fantasy
32,witch christmasparty magic chriscolumbus adventure fantasy family
33,newyork usa worldwarii joejohnston action adventure sciencefiction
34,agedifference centralandsouthamerica balloon petedocter animation comedy family
35,malibu marvelcomic superhero jonfavreau adventure action sciencefiction
36,marvelcomic sequel superhero josswhedon action adventure sciencefiction
37,android galaxy hermit georgelucas adventure action sciencefiction
38,corruption sex sexuality martinscorsese crime drama comedy
39,dream cartoon imaginaryfriend petedocter drama comedy animation
40,lossoffather vigilante serum marcwebb action adventure fantasy
41,newmexico banishment shield kennethbranagh adventure fantasy action
42,competition basedonnovel mentor francislawrence adventure action sciencefiction
43,paris guerrilla cinema quentintarantino drama action thriller
44,adoptivefather orphanage life'sdream pierrecoffin animation family
45,basedonnovel island hurricane martinscorsese drama thriller mystery
46,fathersonrelationship rape basedonnovel alejandrogonzáleziñárritu western drama adventure
47,savingtheworld dccomics superhero zacksnyder action adventure fantasy
48,romanticcomedy andrewstanton animation family
49,underwear tiger stagnight toddphillips comedy
50,cyborg experiment self-destruction jamesmangold action drama sciencefiction
51,fathersonrelationship harbor underwater andrewstanton animation family
52,brotherbrotherrelationship hero talent chriswilliams adventure family animation
53,clocktower carrace terrorist robertzemeckis adventure comedy sciencefiction
54,1970s mutant timetravel bryansinger action adventure fantasy
55,monster infant energysupply petedocter animation comedy family
56,selfsacrifice magic frog davidyates family fantasy adventure
57,spy greatbritain secretorganization matthewvaughn crime comedy action
58,artificialintelligence telepathy intelligence lucbesson action sciencefiction
59,flying traitor magic alfonsocuarón adventure fantasy family
60,marvelcomic superhero basedoncomic peytonreed sciencefiction action adventure
61,italy loveatfirstsight lossoffather francisfordcoppola drama crime
62,basedonnovel marriagecrisis disappearance davidfincher mystery thriller drama
63,rebel android asteroid irvinkershner adventure action sciencefiction
64,flyingcar witch magic chriscolumbus adventure fantasy family
65,self-fulfillingprophecy detective s.w.a.t. davidfincher crime mystery thriller
66,ocean shipwreck hindu anglee adventure drama action
67,gay england worldwarii mortentyldum history drama thriller
68,detective scotlandyard coffin guyritchie action adventure crime
69,washingtond.c. future shield anthonyrusso action adventure sciencefiction
70,magic marvelcomic superhero scottderrickson action adventure fantasy
71,spacemission loss space alfonsocuarón sciencefiction thriller drama
72,resistance post-apocalyptic dystopia francislawrence sciencefiction adventure thriller
73,magic dyinganddeath broom mikenewell adventure fantasy family
74,spacecraft language loss denisvilleneuve thriller drama sciencefiction
75,corruption isolation radio davidyates adventure fantasy family
76,dystopia apocalypse zombie marcforster action drama horror
77,paris bank secret louisleterrier thriller crime
78,prophecy witch lossoflover davidyates adventure fantasy family
79,robbery magic teleportation davidyates adventure family fantasy
80,rome gladiator arena ridleyscott action drama adventure
81,basedonnovel maze post-apocalyptic wesball action mystery sciencefiction
82,france magic castle billcondon family fantasy romance
83,lossofparents wildboar uncle rogerallers family animation drama
84,hitman russianmafia revenge chadstahelski action thriller
85,queen musical princess chrisbuck animation adventure family
86,witch magic broom davidyates adventure fantasy family
87,jealousy toy boy johnlasseter animation comedy family
88,malefriendship masseuse friendship erictoledano drama comedy
89,lossoflover spider thanksgiving samraimi fantasy action
90,witch fortuneteller bondage goreverbinski adventure fantasy action
91,secretidentity secret hero bradbird action adventure animation
92,carrace sequel crime justinlin action thriller crime
93,cia mutant mine matthewvaughn action sciencefiction adventure
94,android dystopia alien ridleyscott sciencefiction adventure mystery
95,warcrimes selfsacrifice warveteran stevenspielberg drama history war
96,rebel spacebattle spacetravel garethedwards action adventure sciencefiction
97,evisceration javelin shield zacksnyder action adventure war
98,japan coma martialarts quentintarantino action crime
99,sea captain mutiny robmarshall adventure action fantasy
100,dccomics hero greekmythology pattyjenkins action adventure fantasy
101,civilization naturaldisaster endoftheworld rolandemmerich action adventure sciencefiction
102,dejavu timewarp restart dougliman action sciencefiction
103,savingtheworld lostcivilisation post-apocalyptic francislawrence drama horror action
104,fox prejudice conspiracy byronhoward animation adventure family
105,exoticisland dna paleontology stevenspielberg adventure sciencefiction
106,dystopia giantrobot giantmonster guillermodeltoro action sciencefiction adventure
107,corruption elves dwarves peterjackson action adventure fantasy
108,marvelcomic superhero basedoncomic alantaylor action adventure fantasy
109,dancing artificialintelligence distrust alexgarland drama sciencefiction
110,spacecraft dystopia space josephkosinski action sciencefiction adventure
111,sequel superhero basedoncomic jamesgunn action adventure comedy
112,dancing philadelphia running davido.russell drama comedy romance
113,mutant supernaturalpowers marvelcomic bryansinger sciencefiction
114,friendship love teddybear sethmacfarlane comedy fantasy
115,basedonnovel dystopia youth neilburger adventure action sciencefiction
116,suicide assassin drugaddiction rianjohnson action thriller sciencefiction
117,basedonnovel fictionalplace queen timburton family fantasy adventure
118,rebel brothersisterrelationship emperor richardmarquand adventure action sciencefiction
119,scotland rebel bravery brendachapman animation adventure comedy
120,crimefighter secretidentity comicbook matthewvaughn action crime
121,jazz dance passion damienchazelle comedy drama music
122,secretagent bakery fallinginlove pierrecoffin animation comedy family
123,assistant aftercreditsstinger duringcreditsstinger kylebalda family animation adventure
124,hostage college toy leeunkrich animation family comedy
125,claustrophobia hiddencamera dystopia peterweir comedy drama
126,timessquare superhero longtake alejandrogonzáleziñárritu drama comedy
127,supportgroup productplacement bullying richmoore family animation comedy
128,hotel painting wartime wesanderson comedy drama
129,elves dwarves orcs peterjackson adventure fantasy
130,ocean drugabuse exoticisland goreverbinski adventure fantasy action
131,fairytale villain sleepingbeauty robertstromberg fantasy adventure action
132,sniper biography iraq clinteastwood war action
133,spacecraft teleportation spacemission j.j.abrams sciencefiction action adventure
134,android countdown spacemarine ridleyscott horror action thriller
135,dancing competition sex darrenaronofsky drama thriller
136,detective vatican fascism jamesmcteigue action thriller fantasy
137,spy basedonnovel secretagent sammendes action adventure crime
138,basedonnovel psychopath horror jonathandemme crime drama thriller
139,prophecy senate queen georgelucas adventure action sciencefiction
140,secretidentity sunglasses undercover barrysonnenfeld action adventure comedy
141,leader colony post-apocalyptic mattreeves sciencefiction action drama
142,paris brotherbrotherrelationship expensiverestaurant janpinkava animation comedy family
143,competition secret obsession christophernolan drama mystery thriller
144,spacecraft friendship sequel j.j.abrams action adventure sciencefiction
145,childabuse kidnapping gore m.nightshyamalan horror thriller
146,undercover boston police martinscorsese drama thriller crime
147,intelligence zoo cage rupertwyatt thriller action drama
148,paris kidnapping humantrafficking pierremorel action thriller
149,factory concentrationcamp hero stevenspielberg drama history war
150,dualidentity loveofone'slife pizzaboy samraimi action adventure fantasy
151,bountyhunter wyoming mountain quentintarantino crime drama mystery
152,jazz obsession conservatory damienchazelle drama
153,fish amnesia sequel andrewstanton adventure animation comedy
154,flying blacksmith arena chrissanders fantasy adventure animation
155,newyork corruption assassin lucbesson thriller crime drama
156,obsession marvelcomic sequel marcwebb action adventure fantasy
157,cyborg shotgun post-apocalyptic jamescameron action thriller sciencefiction
158,carrace speed revenge jameswan action
159,timetravel timemachine alien barrysonnenfeld action comedy sciencefiction
160,artificialintelligence computer love spikejonze romance sciencefiction drama
161,savingtheworld artificialintelligence rebel jamescameron action thriller sciencefiction
162,showdown deathstar vision georgelucas sciencefiction adventure action
163,magic liberation lordship andrewadamson adventure animation comedy
164,mutant marvelcomic superhero bryansinger adventure action sciencefiction
165,individual insulin tattoo christophernolan mystery thriller
166,southernusa blackpeople mentallydisabled frankdarabont fantasy drama crime
167,malefriendship highschool parody phillord action comedy crime
168,malenudity android asteroid mortentyldum adventure drama romance
169,revolution strongwoman dystopia francislawrence action adventure sciencefiction
170,destroy transformation alien michaelbay adventure sciencefiction action
171,japan samurai mutant jamesmangold action sciencefiction adventure
172,corruption mutant boxer gavinhood adventure action thriller
173,senate investigation army georgelucas adventure action sciencefiction
174,brotherbrotherrelationship swordplay katana quentintarantino action crime thriller
175,worldwarii nazis war davidayer war drama action
176,fight sequel mission bradbird action thriller adventure
177,helicopter journalist basedonnovel johnmctiernan action thriller
178,carrace carjourney auto johnlasseter animation adventure comedy
179,detectiveinspector steampunk criminalmastermind guyritchie adventure action crime
180,witch parentchildrelationship magic hayaomiyazaki fantasy adventure animation
181,clone taxi cyborg lucbesson adventure fantasy action
182,humanevolution parentchildrelationship squirrel chriswedge animation comedy family
183,savingtheworld riddle nepal stevenspielberg adventure action
184,italy poker casino martincampbell adventure action thriller
185,skateboarding flyingcar carrace robertzemeckis adventure comedy family
186,basedonnovel revolution dystopia robertschwentke adventure sciencefiction thriller
187,conman biography fbiagent stevenspielberg drama crime
188,museum prosecution identitycrisis johnlasseter animation comedy family
189,hotel isolation hotelier stanleykubrick horror thriller
190,suicide artificialintelligence manvsmachine alexproyas action sciencefiction
191,fictionalplace politician stalking neilburger thriller mystery sciencefiction
192,basedonnovel infidelity obsession bazluhrmann drama romance
193,amsterdam basedonnovel supportgroup joshboone romance drama
194,prison pickpocket stripclub stevensoderbergh thriller crime
195,sunglasses interpol undercovercop toddphillips comedy
196,artificialintelligence bountyhunter dystopia ridleyscott sciencefiction drama thriller
197,stuntman bloodsplatter independentfilm nicolaswindingrefn drama action thriller
198,traitor jewelry psychopath quentintarantino crime thriller
199,submarine sequel betrayal f.garygray action crime thriller
200,whip kidnapping slavery stevemcqueen drama history
201,londonengland fathersonrelationship chocolate timburton adventure comedy family
202,dejavu regret jealousy michelgondry sciencefiction drama romance
203,underdog loveatfirstsight hairdresser timburton fantasy drama romance
204,soulmates vampire forbiddenlove catherinehardwicke adventure fantasy drama
205,dualidentity amnesia sandstorm samraimi fantasy action adventure
206,savingtheworld artificialintelligence cyborg alantaylor sciencefiction action thriller
207,washingtond.c. sistersisterrelationship post-apocalyptic rubenfleischer comedy horror
208,italy riddle bookshop robertobenigni comedy drama
209,paris barcelonaspain assassin dougliman action drama mystery
210,monster dormitory games danscanlon animation family
211,mutant marvelcomic basedoncomic brettratner adventure action sciencefiction
212,circus witch magic samraimi fantasy adventure family
213,parentchildrelationship airplane timetravel richardkelly fantasy drama mystery
214,mutant marvelcomic superhero bryansinger adventure action sciencefiction
215,pet bunny anthropomorphism chrisrenaud animation family
216,bomb cia russia johnmoore action thriller
217,bank future time andrewniccol action thriller sciencefiction
218,dystopia spacestation classconflict neillblomkamp sciencefiction action drama
219,savingtheworld artificialintelligence manvsmachine lillywachowski adventure action thriller
220,magic musical cartoon ronclements animation family comedy
221,hacker hacking creator davidfincher drama
222,streetgang carrace undercover robcohen action crime thriller
223,journalism underground tvstation dangilroy crime drama thriller
224,cia wifehusbandrelationship revolution benaffleck drama thriller
225,ocean sailboat mythology ronclements adventure animation family
226,slum streetgang mutation neillblomkamp sciencefiction
227,malenudity femalenudity adultery sammendes drama
228,prison streetgang rape stanleykubrick sciencefiction drama
229,hostage magic horse byronhoward animation family
230,italo-american cuba vororte francisfordcoppola drama crime
231,individual scotland inlovewithenemy melgibson action drama history
232,wifehusbandrelationship biography physicist jamesmarsh drama romance
233,paris lovetriangle ghosttrain jean-pierrejeunet comedy romance
234,diary navy funeral davidfincher fantasy drama thriller
235,highschool undercovercop buddycomedy phillord crime comedy action
236,londonengland china magic jonm.chu action adventure comedy
237,farewell homesickness nasa stevenspielberg sciencefiction adventure family
238,moon spacecraft traitor michaelbay action sciencefiction adventure
239,basedonnovel perversion spanking samtaylor-johnson drama romance thriller
240,spacecraft patriotism countdown rolandemmerich action adventure sciencefiction
241,law relatives theft bryansinger drama crime thriller
242,lion hippopotamus giraffe ericdarnell family animation
243,exoticisland suicideattempt volleyball robertzemeckis adventure drama
244,japan worldwarii violentfather melgibson drama history war
245,witch blackmagic steampunk tommywirkola fantasy horror action
246,android extraterrestrialtechnology spacemarine jamescameron horror action thriller
247,londonengland spy austria christophermcquarrie action adventure thriller
248,monster godzilla remake garethedwards action sciencefiction thriller
249,china martialarts kungfu markosborne adventure animation family
250,childabuse senseofguilt lossofchild m.nightshyamalan mystery thriller drama
251,savingtheworld venice holygrail stevenspielberg adventure action
252,timetravel orphan superpower timburton drama fantasy adventure
253,himalaya photographer magazine benstiller adventure comedy drama
254,prison basedonnovel florida martinscorsese drama crime
255,paris journalist journalism davidfrankel comedy drama romance
256,egypt sun chaos michaelbay sciencefiction action adventure
257,savingtheworld secretidentity sunglasses barrysonnenfeld action adventure comedy
258,queen magic fairytale rupertsanders adventure fantasy drama
259,pennsylvania kidnapping maze denisvilleneuve drama thriller crime
260,rape warveteran immigration clinteastwood drama
261,sistersisterrelationship exorcism rhodeisland jameswan horror thriller
262,poem river sadness nickcassavetes romance drama
263,fathersonrelationship wifehusbandrelationship sacrifice deandeblois fantasy action adventure
264,vietnamveteran 1970s monster jordanvogt-roberts action adventure fantasy
265,savingtheworld artificialintelligence manvsmachine lillywachowski adventure action thriller
266,basedonnovel resistance maze wesball action
267,malenudity parentchildrelationship camping seanpenn adventure drama
268,sequel alien transformers michaelbay sciencefiction action adventure
269,fathersonrelationship creativity friendship phillord adventure animation comedy
270,artificialintelligence android robot neillblomkamp crime action sciencefiction
271,spain resistance servant guillermodeltoro fantasy drama war
272,christianity moon responsability tomshadyac fantasy comedy
273,usa neo-nazi prison tonykaye drama
274,individual schizophrenia massachusetts ronhoward drama romance
275,newyork riodejaneiro marvelcomic louisleterrier sciencefiction action adventure
276,texas drugtraffic hitman joelcoen crime drama thriller
277,prison magic liberation andrewadamson adventure animation comedy
278,moon jupiter artificialintelligence stanleykubrick sciencefiction mystery adventure
279,shyness secret narration stephenchbosky drama romance
280,mexico police gang rawsonmarshallthurber comedy crime
281,flying alcohol loveofone'slife peterberg fantasy action
282,bomb assassin secretidentity dougliman action comedy drama
283,basedonnovel sniper investigation christophermcquarrie crime drama thriller
284,terror assassin secret jonm.chu adventure action sciencefiction
285,flying fire brothersisterrelationship timstory action adventure fantasy
286,mammoth sloth iceage carlossaldanha animation family comedy
287,clone future dystopia tomtykwer drama sciencefiction
288,prince book castle garytrousdale romance family animation
289,miami corruption capitalism briandepalma action crime drama
290,california earthquake catastrophe bradpeyton action drama thriller
291,killing undercover secretagent marcforster adventure action thriller
292,whitehouse secretservice terroristattack antoinefuqua action thriller
293,whiterussian dude bowling joelcoen comedy crime
294,individual rebel self-destruction milošforman drama
295,corruption assassin hostage antoinefuqua thriller action crime
296,date sex jealousy marcwebb comedy drama romance
297,sequel hangover toddphillips comedy
298,externallycontrolledaction parents-in-law satire jordanpeele mystery thriller horror
299,railroadrobber california delorean robertzemeckis adventure comedy family
300,basedonnovel snake wolf jonfavreau family adventure drama
301,tattoo martialarts sniper sylvesterstallone thriller adventure action
302,women aids biography jean-marcvallée drama history
303,gypsy bareknuckleboxing slang guyritchie thriller crime
304,museum skeleton nightshift shawnlevy action adventure comedy
305,airplane numberintitle airplanecrash simonwest action adventure thriller
306,paris corruption madrid paulgreengrass action drama mystery
307,italy gun roof chadstahelski thriller action crime
308,slum indianlead cheating dannyboyle drama romance
309,fathersonrelationship childlabour brothel bongjoon-ho action sciencefiction drama
310,inventor apocalypse destiny bradbird adventure family mystery
311,artificialintelligence secretidentity computerprogram josephkosinski adventure action sciencefiction
312,dccomics secretidentity massmurder zacksnyder action mystery sciencefiction
313,baseball boston professor gusvansant drama
314,berlin assassin basedonnovel paulgreengrass action drama thriller
315,conartist scam mobster davido.russell drama crime
316,cia retirement shottodeath robertschwentke action adventure comedy
317,riddle treasure heart stevenspielberg adventure action
318,brotherbrotherrelationship adultery mythology wolfgangpetersen adventure drama war
319,basedonnovel carpet isolation lennyabrahamson drama thriller
320,greatbritain radio monarchy tomhooper drama history
321,jupiter space womandirector lillywachowski sciencefiction fantasy action
322,sea ship sequel joachimrønning adventure action fantasy
323,library secretpassage cairo stephensommers adventure action fantasy
324,individual philosophy poetry peterweir drama
325,kidnapping turkey policechase oliviermegaton action crime thriller
326,assassination spain assassin justinkurzel action adventure sciencefiction
327,paris holygrail christianity ronhoward thriller mystery
328,alcohol baby party nicholasstoller comedy
329,dystopia basedoncomic heldcaptive robertrodriguez action thriller crime
330,bomb identity fantasy duncanjones thriller sciencefiction mystery
331,childabuse journalism judge tommccarthy drama thriller history
332,fathersonrelationship fight sport shawnlevy action sciencefiction drama
333,londonengland alcohol sex dannyboyle drama crime
334,bluefootedbooby prehistorictimes meltingice stevemartino animation comedy adventure
335,france beach worldwarii christophernolan action drama history
336,savingtheworld witch basedonnovel andrewadamson adventure family fantasy
337,post-apocalyptic dystopia zombie jonathanlevine horror comedy romance
338,assassin wolf maryland tonygilroy action thriller
339,bank fraud biography adammckay comedy drama
340,android spacetravel alienlife-form ridleyscott horror sciencefiction thriller
341,martialarts terrorist hero jonathanliebesman sciencefiction action adventure
342,paris londonengland spy briandepalma adventure action thriller
343,england basedonnovel depression theasharrock drama romance
344,mountain despair adventure dannyboyle adventure drama thriller
345,self-fulfillingprophecy washingtond.c. evidence stevenspielberg action thriller sciencefiction
346,fire helicopter surfboard timstory adventure fantasy action
347,vampire romance villainess billcondon adventure fantasy drama
348,sequel stranded hatred justinlin action adventure sciencefiction
349,basedonfairytale giant bryansinger action family fantasy
350,spy cia coldwar stevenspielberg thriller drama
351,vietnamveteran taxi obsession martinscorsese crime drama
352,fishing atlanticocean bathing stevenspielberg horror thriller adventure
353,basedonnovel vampire werewolf billcondon adventure fantasy romance
354,witch magic mummy genndytartakovsky animation comedy family
355,sanfrancisco singleparent homelessperson gabrielemuccino drama
356,suicide prostitute helicopter stanleykubrick drama war
357,spy cia undercover paulfeig action comedy crime
358,seduction conman femmefatale glennficarra romance comedy crime
359,assassin lossoffather secretsociety timurbekmambetov action thriller crime
360,dystopia m.nightshyamalan sciencefiction action adventure
361,videogame nerd alienattack chriscolumbus action comedy sciencefiction
362,savingtheworld riddle whip stevenspielberg adventure action
363,budapest subway loveofone'slife lenwiseman fantasy action thriller
364,dccomics transformation superhero martincampbell adventure action thriller
365,alternatehistory alieninvasion rolandemmerich action adventure sciencefiction
366,dualidentity bank mockery chuckrussell romance comedy crime
367,philosophy cyborg hacker rupertsanders action sciencefiction thriller
368,secretagent dystopia remake lenwiseman action sciencefiction adventure
369,savingtheworld paris moon michaelbay action thriller sciencefiction
370,kidnapping bunker paranoia dantrachtenberg thriller sciencefiction drama
371,exoticisland dna paleontology stevenspielberg adventure action sciencefiction
372,drugaddiction junkie heroin darrenaronofsky crime drama
373,spermbank sequel buddy sethmacfarlane comedy
