,soup_words
6968,christianity prophecy sacrifice carlschultz horror thriller mystery
6969,gambling perfectcrime casino lewismilestone thriller music comedy
6970,monopoly tycoon house frankcapra comedy romance
6971,schizophrenia malenudity femalenudity anthonyperkins horror thriller
6972,bunker nazis easterneurope stevebarker action adventure horror
6973,mutiny worldwarii paranoia edwarddmytryk drama war
6974, lesmayfield action comedy crime
6975,muslim iraniannewwave abbaskiarostami drama
6976, chrisnelson comedy
6977,farewell responsability dyinganddeath isabelcoixet drama romance
6978,paris japanese identity christianvolckman action animation sciencefiction
6979,aggressionbyplant killerplant maneatingplant rogercorman comedy
6980, ashutoshgowariker drama
6981,usa 1970s students'movement michelangeloantonioni drama romance
6982,grandfathergrandsonrelationship independentfilm wealth michaelo.sajbel romance drama family
6983,sex americanfootball classroom michaelchapman romance drama
6984,bestechung businessman greed jonathanlynn comedy
6985,basedonnovel sanjayleelabhansali drama romance
6986,wedding moneyproblems pretendrelationship giljunger comedy
6987,monster mutant alien peterramsey tvmovie animation family
6988,paris opera diva rupertjulian drama horror
6989,budapest subway nimródantal comedy crime thriller
6990,spain musicfestival sequel kennyortega comedy drama family
6991,martialarts chinese martialartsmaster johnlaing action adventure family
6992,baseball sport danielstern comedy family
6993,lossofson senseofguilt baseball terrygeorge drama crime thriller
6994,commune suspense maddoctor panoscosmatos fantasy sciencefiction horror
6995,sex firsttime virgin zachcregger comedy romance
6996,newyork cia cuba alfredhitchcock action drama mystery
6997,fistfight police life-saver johnmcnaughton comedy crime romance
6998,janeausten jonjones drama romance
6999,extraterrestrial miniseries disease mikaelsalomon romance sciencefiction thriller
7000,biography fashiondesigner fashion bertrandbonello drama
7001,malenudity femalenudity policebrutality sampeckinpah action comedy drama
7002,predator vacation animal brettsimmons thriller horror
7003,saloon campy saloonowner nicholasray drama western
7004,bankrobbery bartfreundlich family action adventure
7005,tvmovie peterflinth action adventure drama
7006, carloverdone family
7007,venice beach composer luchinovisconti drama
7008,streetgang losangeles johnwhitesell comedy crime
7009,sex detective nudity briandepalma horror thriller
7010,magic biography houdini uliedel tvmovie drama history
7011,hotel smalltown hunger delmerdaves drama western
7012,family womandirector sarahpolley documentary
7013, tilschweiger comedy
7014,dccomics superpowers superhumanstrength joaquimdossantos animation action
7015,law paternity friendship ivanreitman comedy family
7016,shotgun mannequin sadism williamlustig horror
7017,africa exorcism nazis paulschrader horror thriller
7018,swatteam detroitmichigan bennyboom action crime thriller
7019,martialarts showdown general dingsheng action comedy adventure
7020,filmmaking filmproducer videosurveillance davidmamet drama
7021,womandirector jeanneherry drama thriller comedy
7022,warcrimes holocaust jewpersecution frankpierson drama history
7023,england 1970s factory rickygervais drama comedy
7024,bestfriend gangster grapefruit williama.wellman drama action crime
7025,womandirector isabelcoixet thriller mystery
7026,jealousy smalltown marriageproposal orsonwelles romance drama
7027,stalking mountainclimbing eliminationderby abelferry action thriller horror
7028,switzerland bavaria humanvsnature philippstölzl adventure drama action
7029,brotherbrotherrelationship darrenlynnbousman horror thriller
7030,summer lifeguard statenislandnewyorkcity rhysthomas comedy
7031,suicide winter pastor ingmarbergman drama
7032,vietnamveteran sequel murder craigmoss action
7033,mother sistersisterrelationship twinsister stuartgillard comedy drama family
7034,hotel lover(female) concierge barrysonnenfeld comedy romance
7035,self-destruction losangeles hedonism marekkanievska drama crime romance
7036,earthquake losangeles family johnbaumgartner tvmovie action sciencefiction
7037,venice gypsy lovesickness ernstmarischka romance drama
7038,servant monster laboratory stephenfrears drama horror thriller
7039,leave fool nymphomanin paulflaherty comedy crime mystery
7040, jean-jacquesannaud adventure drama
7041,queen franklindelanoroosevelt park rogermichell comedy drama history
7042,artist manipulation illusion orsonwelles documentary
7043, neriparenti comedy
7044,transvestism londonengland gay neiljordan drama comedy
7045,blaxploitation kevinrodneysullivan comedy drama
7046,sanfrancisco estateagent shoppingmall robertstevenson romance comedy family
7047, vikasbahl music comedy foreign
7048,rejection bullying comingofage stephendunn drama
7049,england worldwarii nazis johnsturges adventure drama action
7050,casino florida intelligence sergiocorbucci action comedy
7051,archangelgabriel heaven matteroflifeanddeath shaneabbess fantasy horror action
7052,italy water crisis andreitarkovsky drama romance
7053,chimp jonathankaplan drama
7054,hotel robbery basedonnovel georgearmitage comedy crime
7055,paris capitalism istanbul ernstlubitsch comedy romance
7056,basedoncomic cyberpunk kenjikamiyama animation action thriller
7057,fathersonrelationship lossofbrother newzealand taikawaititi comedy romance
7058,spanking basedonplayormusical tylerperry drama comedy romance
7059, takashimiike action
7060,father faith alexkendrick drama
7061,cult rileystearns thriller drama
7062, rodrigosorogoyen thriller
7063,press policeoperation fugitive andréhunebelle comedy crime adventure
7064,vietnamwar musical biography wayneblair comedy drama
7065,fire supermarket architect markrobson action drama thriller
7066,cooking senseoflife daughter anglee comedy drama romance
7067,highschool violenceinschools gang johng.avildsen drama
7068,pistol violence cowboy johnsturges western
7069,londonengland gay comingout hettiemacdonald comedy drama romance
7070,supermarket steveconrad comedy
7071,wifemurder murderplot scottfoley comedy
7072,lossofson lighthouse lighthousekeeper craigrosenberg mystery thriller drama
7073, stephenchow comedy sciencefiction fantasy
7074,musical waltdisney animation
7075,childabuse baby brothersisterrelationship georgeratliff drama thriller horror
7076,hotel confidence junkie wimwenders drama thriller
7077,sex indianlead dancingmaster daisyvonscherlermayer comedy romance
7078,revenge landwar forcedprostitution paulhyett horror thriller
7079,vampire transformation blood jamesisaac fantasy action horror
7080,dystopia endoftimes timfehlbaum horror sciencefiction thriller
7081,pixaranimation johnlasseter animation
7082,decision reno mustang johnhuston drama action romance
7083,sequel flashbacksequence andrewlau crime drama action
7084,england fabfour music francroddam drama music
7085,sport alainchabat comedy
7086,fathersonrelationship lossofbrother brothersisterrelationship louismalle drama romance
7087,savingtheworld military bradturner sciencefiction action horror
7088,lesbianinterest womandirector catherinecorsini comedy drama romance
7089,clock silentfilm fredc.newmeyer comedy romance
7090,videogame monster lossofenergy mamoruhosoda fantasy animation sciencefiction
7091,mistakeinperson édouardmolinaro comedy
7092,choreographer choreography moderndance wimwenders documentary
7093, antonionegret thriller action
7094,buddhist tibet reincarnation bernardobertolucci drama history
7095,mickeymouse disneyshort minniemouse laurenmacmullan animation family
7096,blindnessandimpairedvision womandirector penelopespheeris comedy romance
7097,malenudity femalenudity shower josephruben drama horror mystery
7098,trailerpark amnesia helsinki akikaurismäki romance comedy drama
7099,shakespeare rome lossofson julietaymor drama history thriller
7100,theatreplay theatregroup highschool tommyo'haver comedy romance
7101, marcoponti romance comedy
7102,handcuffs christmastree murder marcusdunstan crime horror thriller
7103,mars space internet wernerherzog documentary
7104,militarybase victimofmurder jeep hiroyukikitakubo fantasy animation horror
7105, lawrenceroeck action adventure thriller
7106,suicide paradise childabuse johnfawcett horror thriller mystery
7107,wales ruralsetting coalmining johnford drama
7108,miner murder serialkiller georgemihalka thriller horror mystery
7109,ship whale friends sampillsbury adventure
7110,japan brokenengagement suicideattempt takeshikitano drama romance
7111, francisglebas animation family
7112,safecracker heistmovie diamondtheft dong-hunchoi action crime
7113,holiday underdog hotel jacquestati comedy family
7114,elves dwarves orcs julesbass adventure animation family
7115,nevada motel highway percyadlon comedy drama
7116,cuba music son(musikstil) wimwenders documentary music
7117, johnfawcett sciencefiction
7118,newyork sex asylum emilyyoung drama romance
7119,londonengland dancing secretagent siddharthanand action adventure comedy
7120, gabetorres action thriller
7121,sex adultery jealousy paulschrader thriller drama
7122,conman newyorkcity art fredschepisi mystery drama comedy
7123, stuarttownsend action drama
7124,france rape women'ssexualidentity virginiedespentes crime drama romance
7125,lesbian teenager singlemother gabydellal comedy drama
7126,therapist vampire hallucination robertbierman comedy horror
7127,butcher marriage love delbertmann drama romance
7128,capitalism canada politicalactivism markachbar documentary
7129,priceoffame tinaturner blackwoman briangibson drama music
7130,evidence overdose heroin craigr.baxley action thriller sciencefiction
7131,hip-hop danceperformance dance chrisstokes drama
7132,corruption capitalism bankrupt alexgibney documentary
7133,shakespeare fate existentialism tomstoppard comedy drama
7134, darrengrant drama romance
7135,baby genius toddler bobclark sciencefiction comedy family
7136,bigbadwolf disneyshort sillysymphony burtgillett animation
7137,lie bluff basedoncartoon stanleytong comedy family
7138,adultery restaurant textileindustry lucaguadagnino drama romance
7139,goodvsevil adulthumor imaginaryland treyparker animation comedy
7140,compulsivegambling roulette stagnight gregorypoirier comedy romance
7141,sequel leatherface death jeffburr horror thriller
7142,beehive baby-snatching spanishcivilwar víctorerice drama fantasy
7143,england basedonnovel fostersister andreaarnold drama romance
7144,parapsychology alistairlegrand horror sciencefiction thriller
7145,mask wheelchair guillotine andrédetoth crime horror mystery
7146,worldwarii kangje-gyu drama action history
7147, davidleland adventure action comedy
7148,westvirginia revenge rifle joelschumacher horror thriller
7149,siamesetwins basket moodringeyes frankhenenlotter comedy horror
7150,sex infidelity dream eskilvogt drama
7151,wealth bankruptcy womandirector laurengreenfield documentary
7152,newyorkcity bankrobbery jousting billmurray comedy crime
7153,mockumentary folksinger christopherguest comedy music
7154,maritalproblem jeanvigo romance drama
7155, fabiobonifacci comedy
7156,malenudity massmurder nudity joshuaoppenheimer history documentary
7157,sex jealousy girlfriend timblakenelson drama romance thriller
7158,alzheimer'sdisease lovetested johnh.lee drama romance
7159,londonengland britishempire lover miranair drama romance
7160,vatican pope concentrationcamp costa-gavras drama history
7161,loveofone'slife therapist psychology robreiner comedy drama romance
7162, howardstorm horror comedy romance
7163,blinddate love fallinginlove nicholashytner comedy drama romance
7164,bank deserter alabama alexturner horror thriller western
7165,fight pilot outerspace christopherroberts action sciencefiction
7166, robpearlstein comedy
7167,japanese worldwarii midway jacksmight action drama history
7168,depression harvarduniversity rollingstone erikskjoldbjærg drama
7169,middleclass basedoncomic surrealism isaotakahata animation family
7170,sanfrancisco chaos peterbogdanovich comedy romance
7171,grizzlybear wilderness forest davidhackl action horror thriller
7172,ex-lover independentfilm socialsatire kenloach comedy drama
7173,fire cabin friendship aaronmoorhead horror thriller mystery
7174,dialogue confidence invention davidmamet crime drama mystery
7175,3d khumba anthonysilverston animation adventure family
7176,soul fight trap shaneacker animation sciencefiction
7177,satire grotesque giacomociarrapico comedy
7178,germany foreigner parentchildrelationship rainerwernerfassbinder romance drama
7179,adventure farscape miniseries brianhenson action comedy romance
7180,gangster deadendkids reformschool michaelcurtiz drama action crime
7181,carrace carmechanic police gordonchan action thriller
7182,womandirector linawertmüller comedy foreign
7183,wifehusbandrelationship emperor hindu ashutoshgowariker action adventure drama
7184,individual humanevolution philosophy michelgondry drama comedy
7185,tornado basedonmanga alchemy seijimizushima action adventure animation
7186,womandirector lisaazuelos drama romance
7187,fight blindnessandimpairedvision victim brucerobinson crime drama mystery
7188,anthology elvispresley pawnshop waynekramer action comedy
7189,newyork basedonnovel architect andygoddard drama thriller
7190,slapstick citycountrycontrast georgeroyhill comedy
7191, allanmauduit comedy
7192,sex lie college mikebinder comedy drama
7193,sistersisterrelationship crow independentfilm bharatnalluri action sciencefiction thriller
7194,wifehusbandrelationship violenthusband plannedmurder jeremiahs.chechik drama horror mystery
7195,womandirector étiennechatiliez comedy
7196,fathersonrelationship indianlead sanjaypatel animation
7197,assassin revenge sexchange walterhill action crime thriller
7198,villain greatdepression marriage charliechaplin comedy crime drama
7199,manvsmachine mutant future kazuakikiriya drama horror sciencefiction
7200,jealousy secret independentfilm noahbaumbach comedy drama
7201,reanimate conga dancingcorpse robertklane comedy
7202,rehabilitation fame blog marcusbaldini drama
7203,femalenudity sex nudity justjaeckin drama romance
7204,suicide bomb assassination tomtykwer drama thriller romance
7205,china suspense yi'nandiao crime drama mystery
7206, orlandovoneinsiedel documentary war
7207,londonengland basedonnovel key jonathannewman fantasy adventure family
7208,rape detective drugtraffic michaelwinner action crime thriller
7209, briantrenchard-smith action comedy crime
7210,jazz biography historicalfigure doncheadle drama music
7211,tibet marvelcomic basedoncomic patrickarchibald action animation family
7212,publichanging strongbox goldtheft michaelcrichton thriller adventure drama
7213, orenuziel thriller crime drama
7214, mariomonicelli comedy
7215,isolation space astronaut williameubank drama sciencefiction
7216,marinecorps taliban u.s.marine donmichaelpaul war action
7217, cullenhoback documentary
7218,professor independentfilm student noammurro comedy drama romance
7219,africa cat lion alastairfothergill documentary family adventure
7220,island party murder fredwalton horror mystery
7221,suicide asylum nightmare robertharmon horror thriller
7222, ericjudor comedy
7223, bertrandtavernier comedy
7224,sequel hideonakata fantasy action thriller
7225,cia undercover violin standragoti action comedy
7226,lossofdaughter hit-and-rundriving revenge seanpenn drama thriller
7227, damiannieman action thriller crime
7228,paris prostitute pimp billywilder comedy romance
7229,cruelty burden beastofburden robertbresson drama
7230,drugaddiction love betrayal jerryschatzberg drama romance
7231,brothersisterrelationship sistersisterrelationship newlove jacquesdemy music romance drama
7232,gambling snake passenger prestonsturges comedy romance
7233,lover(female) worldwarii radiotransmission michaelapted mystery drama thriller
7234,mutation aggressionbyplant musical johndebello comedy horror sciencefiction
7235,factory fog michelangeloantonioni drama
7236,paris france worldwarii johnfrankenheimer action drama thriller
7237,transporter nazis boardingschool dennisgansel drama
7238,eroticmovie martingero comedy drama romance
7239,baseball sport littleleague richardlinklater comedy family
7240,manga alien shinsukesato horror action sciencefiction
7241,manager pop secret harryelfont comedy music
7242,worldwarii island bomber mikenichols war comedy drama
7243,detective greece murdermystery guyhamilton thriller crime mystery
7244,assassination martialarts assassin andrewlau drama action history
7245,prince bride sequel catherinecyran comedy family romance
7246,photographer biography hair stevenshainberg drama mystery romance
7247,prison escape urination jacquesbecker crime drama thriller
7248, edoardoleo comedy
7249,christian haroldcronk drama
7250,women jealousy samurai kanetoshindô horror
7251,library spy coldwar martinritt drama thriller
7252,shakespeare hero kingdom kennethbranagh war drama history
7253, marka.lewis horror sciencefiction thriller
7254,civilwar dictator journalist oliverstone drama
7255,womandirector partfiction docufiction iainforsyth documentary drama music
7256,robbery junkie investigation jamescox crime drama mystery
7257, benjaminguedj comedy
7258,obsession fanculture maneeshsharma action drama thriller
7259,robbery miner treachery mateogil adventure action western
7260,asia abandonedhouse remake takashishimizu horror thriller
7261,treasurehunt girls'boardingschool pirate barnabythompson comedy adventure
7262,italy scotlandyard letter georgecukor drama mystery thriller
7263,policebrutality seer massacre lucbesson drama
7264,angel england worldwarii emericpressburger fantasy drama romance
7265,poker sailboat dualidentity renéclément crime drama thriller
7266,racialtension americanfootballplayer murdertrial ezraedelman documentary
7267,suicide circus shrine alejandrojodorowsky fantasy horror mystery
7268, wongkar-wai drama action
7269,detective assassin jealousy johnherzfeld comedy crime
7270,japan samurai fight sionsono drama action comedy
7271,depression christmasparty deaf-mute jamiebabbit drama thriller
7272,sailingtrip knife romanpolanski drama
7273,femalenudity poison 1970s annabiller comedy fantasy horror
7274,homeless lice paulweitz drama
7275,frog cop remake canevrenol fantasy horror
7276,wifehusbandrelationship hungary mountain ernstmarischka drama comedy romance
7277,pokémon anime masamitsuhidaka animation family
7278,assassination attemptedkidnapping alfredhitchcock drama thriller
7279,supermodel stalking models markwaters comedy romance
7280,oldfriends suicidethoughts joachimtrier drama
7281,parentchildrelationship fish transformation stefanfjeldmark adventure animation comedy
7282,prostitute investigation specialunit leetamahori drama mystery thriller
7283,fathersonrelationship daughter revenge louisdefunès comedy
7284,newyork undercoveragent irishmob philjoanou drama action thriller
7285,hacker cyber hacking brianknappenberger documentary
7286,womandirector valérielemercier comedy
7287, steffenhaars action comedy
7288,paris worldwarii 1940s volkerschlöndorff drama
7289,rapmusic hip-hop damiendantewayans action comedy music
7290,hacking cybercrime alexgibney documentary
7291,fathersonrelationship middleeast hotel briandepalma horror sciencefiction thriller
7292,basedonvideogame uweboll action sciencefiction thriller
7293,weddingvows marriage love dermotmulroney comedy romance
7294, williamkaufman action thriller
7295,psychological alistairlegrand thriller
7296,independentfilm money stephenmilburnanderson crime thriller comedy
7297,sexualattraction cuban critic isabelcoixet drama romance
7298,londonengland education teacher jamesclavell drama
7299,anthology mariobava horror
7300,disaster koreanmovie trappedunderground kimseong-hoon drama thriller
7301,worldwarii bootcamp biloximississippi mikenichols comedy drama romance
7302,malenudity adolescence nostalgia s.j.clarkson drama comedy history
7303,sex terrorist beach bengarant action adventure comedy
7304,mistakenidentity martialartsmaster pianist tsuihark comedy action
7305,rome summer teenager stevepurcell action adventure comedy
7306,womandirector icíarbollaín drama history
7307,horserace horse kentucky johngatins drama family
7308,martialarts fight training michaeljaiwhite drama action
7309,nurse cat torture rolfdeheer crime drama
7310,sex nudity seduction clémentvirgo drama
7311,womandirector isabelledoval comedy
7312,newyork couple lossofachild nedbenson romance drama
7313,martialarts neo-noir wilsonyip action crime drama
7314,policebrutality baby police paulschrader drama crime thriller
7315, alexandrelehmann drama
7316,lesbianrelationship lgbt williamwyler drama
7317,rockandroll showbusiness rockstar rennyharlin action comedy thriller
7318,dinosaur royallensmith family animation adventure
7319,sistersisterrelationship autism satanism chuckrussell drama horror thriller
7320,themuppets kermitthefrog marretas jimhenson crime family comedy
7321,robbery showdown horsebackriding anthonymann western
7322,martialarts kungfu government liuchia-liang action adventure
7323,gangster fbiagent herbertross action comedy
7324,ninja anime naruto tensaiokamura comedy action animation
7325,hitchhiker injuredleg caraccident iainsoftley horror thriller
7326,bounty captain boat franklloyd adventure drama history
7327,norway norwegian viking terryjones adventure fantasy comedy
7328,usapresident monster dream josephruben adventure horror sciencefiction
7329,yakuza marine fighting erniebarbarash adventure action
7330,stand-upcomedy louisc.k. comedy
7331,dog short pixaranimation ronniedelcarmen animation comedy family
7332,holiday christmas julesbass family animation tvmovie
7333,survival scubadiving underwater ronscalpello drama thriller
7334,lover psychoanalyst erotique françoisozon thriller
7335,suicide callgirl sex marcoferreri drama comedy
7336,fathersonrelationship secretagent basedoncomic javierruizcaldera action comedy
7337,party hospital writer michelangeloantonioni drama
7338,serum werewolf brettsullivan drama horror
7339,alaska family nature alastairfothergill documentary family
7340,usapresident presidentialelection watergatescandal oliverstone history drama
7341,shield marvelcomic marvelcinematicuniverse leythum sciencefiction fantasy
7342,fish bed thai apichatpongweerasethakul comedy drama fantasy
7343,deaf-mute listening man-womanrelation randahaines drama romance
7344,wrestling sport aliabbaszafar drama action
7345,profession sadness therapist nannimoretti drama
7346,hippie roommate fantasy greggaraki comedy
7347,tastelessness filmandcinema basedontvseries jimmallon comedy sciencefiction
7348,prison americanfootball sport robertaldrich crime comedy drama
7349,usa blackpeople usapresident chrisrock comedy
7350, vincentgrashaw thriller drama
7351,aliceinwonderland rabbit teaparty nickwilling fantasy family
7352,adventure animal noah'sark tobygenkel animation adventure comedy
7353,mayor barn flattire michellemaclaren drama horror mystery
7354,babysitter remake johnschultz tvmovie comedy
7355,wheelchair vampire hauntedhouse anthonyhickox horror comedy
7356,"anime dragonball, mitsuohashimoto action animation"
7357,halloween possession demon kevintenney horror
7358,paris prison africa georgeslautner action adventure thriller
7359,newyork architect forbiddenlove spikelee drama romance
7360,france fight louisxiii. richardlester action adventure comedy
7361,lovesickness newlove loveofone'slife krisisacsson comedy drama family
7362, farhanakhtar drama romance
7363,newmexico love revenge loganmiller western thriller
7364,twinsister womandirector sisterhood samanthafuterman family documentary
7365,monster cardgame fight hatsukitsuji adventure fantasy animation
7366,senate fight salesman robertzemeckis action comedy
7367,curse newengland edgarallanpoe rogercorman horror thriller
7368,martialarts pizzeria limousine michaelschultz action adventure comedy
7369,hippie sweden 1970s lukasmoodysson drama comedy romance
7370,font garyhustwit documentary
7371,shop undercoveragent illegality mikefiggis crime drama
7372,smalltown visa stasi christianpetzold drama
7373,blackpeople newjersey lie joeroth drama thriller crime
7374,mumblegore chadcrawfordkinkle horror thriller drama
7375,killersantaclaus holidayhorror christmashorror stevenc.miller comedy horror thriller
7376, francisfordcoppola drama
7377,highschool teenager robot paulhoen family sciencefiction
7378,england rain firemen jimmyt.murakami animation comedy drama
7379,painter rivalry teacher fredschepisi comedy drama romance
7380,friendship ferzanozpetek drama
7381,france prison airport fredcavayé drama thriller
7382,behindthescenes fanculture visualeffect joshoreck documentary
7383,monster mystic church olegstepchenko thriller adventure mystery
7384,pet dragon colinlevy animation fantasy
7385,rebel sword wilderness samfirstenberg action adventure
7386,wifehusbandrelationship newlove family luismandoki drama romance
7387,nerd vacation farce joeroth comedy
7388,retiree chaos retirement jeangirault comedy
7389,jazz jazzmusician musical francisfordcoppola music drama crime
7390,nightmare primalfear anthonydiblasi horror drama thriller
7391,airplane fistfight thin giuseppecolizzi adventure action comedy
7392, zackwhedon drama thriller
7393, jimmalone action adventure animation
7394,flying empowerment airplane miranair adventure
7395,basedonnovel brothersisterrelationship canada kevinsullivan drama family
7396,trainstation inlovewithenemy worldwarii larsvontrier thriller drama
7397,adultery eroticism imsang-soo thriller drama
7398,gambling sex casino robreiner comedy romance
7399, erikvanlooy drama mystery romance
7400, darrengrant comedy drama romance
7401, davidf.sandberg horror
7402,mississippi childhoodmemory dog jayrussell comedy drama family
7403,newyork teenager alanparker drama action comedy
7404, gérardpirès adventure comedy
7405,sport icehockey jayroach drama comedy
